[
  {
    "api_version": "metactl/v2alpha1",
    "subject_ref": {
      "kind": "pack",
      "id": "repo-review-instructions",
      "version": "1.0.0"
    },
    "digest": "sha256:aaaaaaaaaaaaaaaaaaaaaaaaaaaaaaaa",
    "origin": "packs/repo-review-instructions",
    "imported_from_ecosystem": "first_party",
    "imported_at": "2026-03-25T20:00:00Z",
    "review": {
      "reviewed_by": "core-team",
      "reviewed_at": "2026-03-25T20:00:00Z",
      "promotion_status": "promoted"
    },
    "attestation_refs": [
      "attest/repo-review-instructions.sig"
    ],
    "validation_refs": [
      "validation/repo-review-instructions.json"
    ]
  },
  {
    "api_version": "metactl/v2alpha1",
    "subject_ref": {
      "kind": "pack",
      "id": "unit-test-loop",
      "version": "1.0.0"
    },
    "digest": "sha256:bbbbbbbbbbbbbbbbbbbbbbbbbbbbbbbb",
    "origin": "packs/unit-test-loop",
    "imported_from_ecosystem": "custom",
    "imported_at": "2026-03-25T20:00:00Z",
    "review": {
      "reviewed_by": "ops-team",
      "reviewed_at": "2026-03-25T20:00:00Z",
      "promotion_status": "promoted"
    },
    "attestation_refs": [
      "attest/unit-test-loop.sig"
    ],
    "validation_refs": [
      "validation/unit-test-loop.json"
    ]
  },
  {
    "api_version": "metactl/v2alpha1",
    "subject_ref": {
      "kind": "pack",
      "id": "dangerous-network-scraper",
      "version": "0.1.0"
    },
    "digest": "sha256:cccccccccccccccccccccccccccccccc",
    "origin": "https://example.com/dangerous-network-scraper",
    "imported_from_ecosystem": "skill_md",
    "imported_at": "2026-03-25T20:00:00Z",
    "review": {
      "reviewed_by": "import-bot",
      "reviewed_at": "2026-03-25T20:00:00Z",
      "promotion_status": "candidate"
    },
    "attestation_refs": [],
    "validation_refs": []
  }
]
