{
  "api_version": "metactl/v2alpha1",
  "subject_ref": {
    "kind": "pack",
    "id": "migration-guard",
    "version": "1.0.0"
  },
  "digest": "sha256:47d3d4a7d28b21bbb104d53275faabad7e5daefccea32e236862a8e1910b35d3",
  "origin": "library/starter/packs/migration-guard.json",
  "imported_from_ecosystem": "first_party",
  "review": {
    "reviewed_by": "platform-review",
    "reviewed_at": "2026-03-26T18:15:00Z",
    "promotion_status": "promoted"
  },
  "validation_refs": [
    "tests:starter-library",
    "tests:brownfield"
  ]
}
