{
  "api_version": "metactl/v2alpha1",
  "subject_ref": {
    "kind": "pack",
    "id": "repo-review-instructions",
    "version": "1.0.0"
  },
  "digest": "sha256:e933325d2d285dc2b141a44d48bcc1ac45960970b852508cd0f6d5be435ad785",
  "origin": "library/starter/packs/repo-review-instructions.json",
  "imported_from_ecosystem": "first_party",
  "review": {
    "reviewed_by": "platform-review",
    "reviewed_at": "2026-03-26T18:00:00Z",
    "promotion_status": "promoted"
  },
  "validation_refs": [
    "tests:starter-library",
    "tests:reviewer-compile"
  ]
}
