{
  "api_version": "metactl/v2alpha1",
  "subject_ref": {
    "kind": "pack",
    "id": "metactl-project-onboarding",
    "version": "1.0.0"
  },
  "digest": "sha256:metactl-project-onboarding",
  "origin": "library/starter/packs/metactl-project-onboarding.json",
  "imported_from_ecosystem": "first_party",
  "review": {
    "reviewed_by": "platform-review",
    "reviewed_at": "2026-04-23T12:00:00Z",
    "promotion_status": "promoted"
  },
  "validation_refs": [
    "tests:search_finds_project_onboarding_for_brownfield_install_queries",
    "tests:starter-library"
  ]
}
