{
  "api_version": "metactl/v2alpha1",
  "subject_ref": {
    "kind": "pack",
    "id": "library-organization-guide",
    "version": "1.0.0"
  },
  "digest": "sha256:27081e7cf16cc74ad8a046d4a43bb44c17c12a708c36aac04e671c39eacf0b83",
  "origin": "library/starter/packs/library-organization-guide.json",
  "imported_from_ecosystem": "first_party",
  "review": {
    "reviewed_by": "platform-review",
    "reviewed_at": "2026-04-22T20:00:00Z",
    "promotion_status": "promoted"
  },
  "validation_refs": [
    "tests:starter-library"
  ]
}
