{
  "api_version": "metactl/v2alpha1",
  "subject_ref": {
    "kind": "pack",
    "id": "python-refactor",
    "version": "2.0.0"
  },
  "digest": "sha256:python-refactor",
  "origin": "curated-root/packs/python-refactor.json",
  "imported_from_ecosystem": "first_party",
  "review": {
    "promotion_status": "promoted"
  }
}
