{
  "api_version": "metactl/v2alpha1",
  "subject_ref": {
    "kind": "pack",
    "id": "python-refactor",
    "version": "2.0.0"
  },
  "digest": "sha256:742e7a50940bd580666811769ccff2cc2501f432841e15572f81242f6144f6c9",
  "origin": "library/starter/packs/python-refactor.json",
  "imported_from_ecosystem": "first_party",
  "review": {
    "reviewed_by": "platform-review",
    "reviewed_at": "2026-03-26T18:10:00Z",
    "promotion_status": "promoted"
  },
  "validation_refs": [
    "tests:starter-library",
    "tests:brownfield"
  ]
}
